<?xml version="1.0"?>

<Sport
xmlns:xsi="http://www.w3.org/2001/XMLSchema-instance"
xsi:noNamespaceSchemaLocation="http://www.w3school.com.cn lab1_2.xsd">

	<Event>
		<EventName>Sports Meeting</EventName>
		
		<Race>
			<RaceNumber>No.1</RaceNumber>
			<RaceDistance>300m</RaceDistance> 
			<RaceComment>good!</RaceComment> 
			<Horse status="active">
				<HorseName>Mary</HorseName>
				<Teamster>
					<TeamsterName>red team </TeamsterName>
					<TeamsterComment>good </TeamsterComment>
				</Teamster>
			    <HorseComment>good</HorseComment>
			</Horse>
		</Race>

  	
	</Event>
</Sport>